{
  "generatedAt": "2026-03-05T04:23:33.313Z",
  "matrixPath": "/Users/jonathanreed/Downloads/NautilusBot/nautilus-bot/docs/packaged-app-qa-matrix.md",
  "summary": {
    "total": 49,
    "pass": 0,
    "fail": 0,
    "blocked": 49,
    "pending": 0
  },
  "rows": [
    {
      "area": "Install",
      "testCase": "Fresh install from signed DMG",
      "status": "BLOCKED",
      "evidence": "artifacts/qa/macos/install-fresh-dmg.md",
      "owner": "qa-macos"
    },
    {
      "area": "Install",
      "testCase": "Upgrade from previous released version",
      "status": "BLOCKED",
      "evidence": "artifacts/qa/macos/install-upgrade.md",
      "owner": "qa-macos"
    },
    {
      "area": "Security",
      "testCase": "Gatekeeper assessment accepted",
      "status": "BLOCKED",
      "evidence": "artifacts/qa/macos/security-gatekeeper.md",
      "owner": "qa-macos"
    },
    {
      "area": "Security",
      "testCase": "Notarization ticket validated",
      "status": "BLOCKED",
      "evidence": "artifacts/qa/macos/security-notarization.md",
      "owner": "qa-macos"
    },
    {
      "area": "Permissions",
      "testCase": "Microphone permission flow",
      "status": "BLOCKED",
      "evidence": "artifacts/qa/macos/permissions-microphone.md",
      "owner": "qa-macos"
    },
    {
      "area": "Permissions",
      "testCase": "Accessibility permission flow",
      "status": "BLOCKED",
      "evidence": "artifacts/qa/macos/permissions-accessibility.md",
      "owner": "qa-macos"
    },
    {
      "area": "Onboarding",
      "testCase": "Normal user onboarding completes and persists baseline settings",
      "status": "BLOCKED",
      "evidence": "artifacts/qa/macos/onboarding-normal.md",
      "owner": "qa-macos"
    },
    {
      "area": "Onboarding",
      "testCase": "Power user onboarding completes and persists advanced storage/retention settings",
      "status": "BLOCKED",
      "evidence": "artifacts/qa/macos/onboarding-power.md",
      "owner": "qa-macos"
    },
    {
      "area": "Capture",
      "testCase": "Dictation hotkey end-to-end",
      "status": "BLOCKED",
      "evidence": "artifacts/qa/macos/capture-dictation-hotkey.md",
      "owner": "qa-macos"
    },
    {
      "area": "Capture",
      "testCase": "Meeting recording mic-only",
      "status": "BLOCKED",
      "evidence": "artifacts/qa/macos/capture-meeting-mic.md",
      "owner": "qa-macos"
    },
    {
      "area": "Capture",
      "testCase": "Meeting recording with system audio (where available)",
      "status": "BLOCKED",
      "evidence": "artifacts/qa/macos/capture-meeting-system-audio.md",
      "owner": "qa-macos"
    },
    {
      "area": "Capture",
      "testCase": "Meeting processing UX: immediate `processing` status + spinner + detail auto-refresh",
      "status": "BLOCKED",
      "evidence": "artifacts/qa/macos/capture-processing-ux.md",
      "owner": "qa-macos"
    },
    {
      "area": "Capture",
      "testCase": "3h+ meeting soak (mic + system audio) completes transcript end-to-end",
      "status": "BLOCKED",
      "evidence": "artifacts/qa/macos/capture-soak-3h.md",
      "owner": "qa-macos"
    },
    {
      "area": "Retention",
      "testCase": "Transcript-only storage deletes audio and keeps transcript accessible",
      "status": "BLOCKED",
      "evidence": "artifacts/qa/macos/retention-transcript-only.md",
      "owner": "qa-macos"
    },
    {
      "area": "Retention",
      "testCase": "Meeting retention `audio_only` clears file/path but keeps transcript",
      "status": "BLOCKED",
      "evidence": "artifacts/qa/macos/retention-audio-only.md",
      "owner": "qa-macos"
    },
    {
      "area": "Retention",
      "testCase": "Meeting retention `audio_and_transcript` deletes full entity",
      "status": "BLOCKED",
      "evidence": "artifacts/qa/macos/retention-audio-and-transcript.md",
      "owner": "qa-macos"
    },
    {
      "area": "Transcription",
      "testCase": "Whisper transcription end-to-end",
      "status": "BLOCKED",
      "evidence": "artifacts/qa/macos/transcription-whisper-e2e.md",
      "owner": "qa-macos"
    },
    {
      "area": "AI",
      "testCase": "Local analysis (Ollama) flow",
      "status": "BLOCKED",
      "evidence": "artifacts/qa/macos/ai-ollama-local.md",
      "owner": "qa-macos"
    },
    {
      "area": "Backup",
      "testCase": "Create backup / restore backup",
      "status": "BLOCKED",
      "evidence": "artifacts/qa/macos/backup-create-restore.md",
      "owner": "qa-macos"
    },
    {
      "area": "Backup",
      "testCase": "Cloud provider setup + sync + restore (at least one provider)",
      "status": "BLOCKED",
      "evidence": "artifacts/qa/macos/backup-cloud-sync.md",
      "owner": "qa-macos"
    },
    {
      "area": "Updates",
      "testCase": "Stable channel check + install",
      "status": "BLOCKED",
      "evidence": "artifacts/qa/macos/updates-stable-install.md",
      "owner": "qa-macos"
    },
    {
      "area": "Licensing",
      "testCase": "Trial expiry + nag behavior",
      "status": "BLOCKED",
      "evidence": "artifacts/qa/macos/licensing-trial-expiry.md",
      "owner": "qa-macos"
    },
    {
      "area": "Licensing",
      "testCase": "License activation/deactivation",
      "status": "BLOCKED",
      "evidence": "artifacts/qa/macos/licensing-activate-deactivate.md",
      "owner": "qa-macos"
    },
    {
      "area": "Licensing",
      "testCase": "License tiers unlock correct features (basic/pro/friends-club)",
      "status": "BLOCKED",
      "evidence": "artifacts/qa/macos/licensing-tier-matrix.md",
      "owner": "qa-macos"
    },
    {
      "area": "Licensing",
      "testCase": "30-day pro lockout behavior verified",
      "status": "BLOCKED",
      "evidence": "artifacts/qa/macos/licensing-30-day-lockout.md",
      "owner": "qa-macos"
    },
    {
      "area": "Install",
      "testCase": "Fresh install from signed installer",
      "status": "BLOCKED",
      "evidence": "artifacts/qa/windows/install-fresh-installer.md",
      "owner": "qa-windows"
    },
    {
      "area": "Install",
      "testCase": "Upgrade from previous released version",
      "status": "BLOCKED",
      "evidence": "artifacts/qa/windows/install-upgrade.md",
      "owner": "qa-windows"
    },
    {
      "area": "Security",
      "testCase": "Authenticode signature valid",
      "status": "BLOCKED",
      "evidence": "artifacts/qa/windows/security-authenticode.md",
      "owner": "qa-windows"
    },
    {
      "area": "Security",
      "testCase": "SmartScreen publisher display",
      "status": "BLOCKED",
      "evidence": "artifacts/qa/windows/security-smartscreen.md",
      "owner": "qa-windows"
    },
    {
      "area": "Permissions",
      "testCase": "Microphone permission flow",
      "status": "BLOCKED",
      "evidence": "artifacts/qa/windows/permissions-microphone.md",
      "owner": "qa-windows"
    },
    {
      "area": "Onboarding",
      "testCase": "Normal user onboarding completes and persists baseline settings",
      "status": "BLOCKED",
      "evidence": "artifacts/qa/windows/onboarding-normal.md",
      "owner": "qa-windows"
    },
    {
      "area": "Onboarding",
      "testCase": "Power user onboarding completes and persists advanced storage/retention settings",
      "status": "BLOCKED",
      "evidence": "artifacts/qa/windows/onboarding-power.md",
      "owner": "qa-windows"
    },
    {
      "area": "Capture",
      "testCase": "Dictation hotkey end-to-end",
      "status": "BLOCKED",
      "evidence": "artifacts/qa/windows/capture-dictation-hotkey.md",
      "owner": "qa-windows"
    },
    {
      "area": "Capture",
      "testCase": "Meeting recording mic-only",
      "status": "BLOCKED",
      "evidence": "artifacts/qa/windows/capture-meeting-mic.md",
      "owner": "qa-windows"
    },
    {
      "area": "Capture",
      "testCase": "Meeting recording with loopback/system audio",
      "status": "BLOCKED",
      "evidence": "artifacts/qa/windows/capture-meeting-system-audio.md",
      "owner": "qa-windows"
    },
    {
      "area": "Capture",
      "testCase": "Meeting processing UX: immediate `processing` status + spinner + detail auto-refresh",
      "status": "BLOCKED",
      "evidence": "artifacts/qa/windows/capture-processing-ux.md",
      "owner": "qa-windows"
    },
    {
      "area": "Capture",
      "testCase": "3h+ meeting soak (mic + system audio) completes transcript end-to-end",
      "status": "BLOCKED",
      "evidence": "artifacts/qa/windows/capture-soak-3h.md",
      "owner": "qa-windows"
    },
    {
      "area": "Retention",
      "testCase": "Transcript-only storage deletes audio and keeps transcript accessible",
      "status": "BLOCKED",
      "evidence": "artifacts/qa/windows/retention-transcript-only.md",
      "owner": "qa-windows"
    },
    {
      "area": "Retention",
      "testCase": "Meeting retention `audio_only` clears file/path but keeps transcript",
      "status": "BLOCKED",
      "evidence": "artifacts/qa/windows/retention-audio-only.md",
      "owner": "qa-windows"
    },
    {
      "area": "Retention",
      "testCase": "Meeting retention `audio_and_transcript` deletes full entity",
      "status": "BLOCKED",
      "evidence": "artifacts/qa/windows/retention-audio-and-transcript.md",
      "owner": "qa-windows"
    },
    {
      "area": "Transcription",
      "testCase": "Whisper transcription end-to-end",
      "status": "BLOCKED",
      "evidence": "artifacts/qa/windows/transcription-whisper-e2e.md",
      "owner": "qa-windows"
    },
    {
      "area": "AI",
      "testCase": "Local/remote analysis configured paths",
      "status": "BLOCKED",
      "evidence": "artifacts/qa/windows/ai-analysis-paths.md",
      "owner": "qa-windows"
    },
    {
      "area": "Backup",
      "testCase": "Create backup / restore backup",
      "status": "BLOCKED",
      "evidence": "artifacts/qa/windows/backup-create-restore.md",